{
  "format": "moonwitness-revelation-identity/v1",
  "policy": {
    "inferIdentityEquivalence": false,
    "canonImpliesRevelationIdentity": false
  },
  "entities": [
    {
      "id": "mw:work:quran-revelation",
      "identityClass": "RevelationIdentity",
      "label": "Qur’an",
      "tradition": "islamic"
    },
    {
      "id": "mw:work:taurat-revelation",
      "identityClass": "RevelationIdentity",
      "label": "Taurat",
      "tradition": "islamic"
    },
    {
      "id": "mw:work:zabur-revelation",
      "identityClass": "RevelationIdentity",
      "label": "Zabur",
      "tradition": "islamic"
    },
    {
      "id": "mw:work:injil-revelation",
      "identityClass": "RevelationIdentity",
      "label": "Injil",
      "tradition": "islamic"
    }
  ],
  "relations": []
}
